id,name,phone_number,url,notification,primary_care_doctor,adress,holiday_support
2381,戸島医院,0339565275,-,事前に電話でのご予約をお願いします。屋外対応となります。ご了承ください。,0,東京都板橋区大谷口2-3-5,0.0
2382,医療法人社団親豊会あおぞらクリニック,web予約,https://www.489map.com/helios/A6245008/reserve,祝日は、土日と同じ診療時間となります。,1,東京都板橋区向原3-10-18松前屋ビルディング1階,1.0
2383,医療法人社団博鳳会敬愛病院附属ｸﾘﾆｯｸ,03-5986-2055,-,なし,0,東京都板橋区向原3-10-6,0.0
2384,医療法人社団博鳳会敬愛病院,03-3973-3811,-,なし,0,東京都板橋区向原３-１０-23,0.0
2385,たにもとクリニック,03-3530-8327,-,なし,0,東京都板橋区向原3-10-15-102,0.0
2386,平成ホームクリニック,03-5926-4491,-,なし,0,東京都板橋区向原三丁目７-７コーシャハイム向原７号棟２階,0.0
2387,医療法人社団 桐心会 林クリニック,03-3956-2090,-,当院ホームページを確認の上、お手数ですがお電話で予約をお願い致します。当院のWeb予約は発熱患者さん・コロナ疑い患者さん用ではありませんのでご注意ください。,1,東京都板橋区小茂根4-28-14,0.0
2388,心身障害児総合医療療育センター,03-3974-2146,-,なし,0,東京都板橋区小茂根1-1-10,2
2389,一般財団法人精神医学研究所 附属 東京武蔵野病院,03-5986-3111,-,なし,0,東京都板橋区小茂根4-11-11,2
2390,吉野内科クリニック,03-3530-3885,-,なし,0,東京都板橋区小茂根4‐8‐22,2
2391,そう内科クリニック,03-3973-0711,-,なし,0,東京都板橋区小茂根 1-21-4 アルファビル1階A室,0.0
2392,医療法人知真会 小茂根内科クリニック,03-5995-6610,-,かかりつけ患者様で診察希望の方は、電話で予約をとってからお越しください。,0,東京都板橋区小茂根3-2-15,0.0
2393,帝京大学医学部附属病院,03-3964-1211,-,事前にお電話にてご相談ください。,0,東京都板橋区加賀2-11-1,0.0
2394,日本大学医学部附属板橋病院,03-3972-8111,-,なし,1,東京都板橋区大谷口上町３０番１号,0.0
2395,山手醫院,03-5918-7997,-,なし,1,東京都板橋区舟渡3-12-13,0.0
2396,医療法人社団田島厚生会 舟渡病院,03-3968-8851,-,なし,0,東京都板橋区舟渡2-19-12,0.0
2397,医療法人社団明芳会板橋中央総合病院付属アイ・タワークリニック,03-5970-2716,-,なし,1,東京都板橋区舟渡1-13-10,0.0
2398,医療法人社団友徳会ふなどファミリークリニック,03-6279-8834,-,なし,0,東京都板橋区舟渡二丁目４番１号サンアートビル１階ーA号室,2
2399,医療法人社団慈誠会 浮間舟渡病院,03-5994-5111,-,なし,1,東京都板橋区舟渡1-17-1,0.0
2400,ねづクリニック,03-5914-0236,-,なし,0,東京都板橋区東坂下２-３-６-１０１,0.0
2401,医療法人社団順済会志村坂クリニック,03-3966-6720,-,なし,0,東京都板橋区東坂下１-９-５リビエールオオノ１階,0.0
2402,医療法人社団 和親会 いわた医院,03-3965-5070,-,なし,1,東京都板橋区坂下１-３５-１７,0.0
2403,医療法人財団健康文化会 坂下診療所,03-3966-3349,-,なし,0,東京都板橋区坂下1-12-20,0.0
2404,徳山内科外科,03-3966-8737,-,なし,0,東京都板橋区坂下3-12-10,2
2405,清水クリニック,03-3966-5314,-,なし,1,東京都板橋区坂下２-２８-７,2
2406,あかまつ透析クリニック,03-5920-6511,-,なし,0,東京都板橋区相生町10-12,1.0
2407,すずき内科,03-5918-9968,-,なし,1,東京都板橋区蓮根３-９-１１ライオンズプラザ西台駅前１階A号室,0.0
2408,すがやこどもクリニック,web予約,https://www.blogger.com/blog/post/edit/7126238244161884362/4126656379221482847,なし,1,東京都板橋区小豆沢2-36-13マツエクリニックビル3階,0.0
2409,医療法人財団 健康文化会 小豆沢病院,03-3966-8411,-,なし,1,東京都板橋区小豆沢１丁目６番８号,1.0
2410,医療法人社団明芳会板橋中央総合病院,03-3967-1181,-,なし,1,東京都板橋区小豆沢2丁目12番7号,1.0
2411,はなだ内科クリニック,03-5392-1314,-,なし,1,東京都板橋区小豆沢2丁目36番13号 マツエクリニックビル2F,0.0
2412,医療法人社団共助会 共助会医院,03-3966-2577,-,なし,1,東京都板橋区小豆沢2-26-8,0.0
2413,幸田整形外科医院,03-5970-7488,-,なし,0,東京都板橋区小豆沢2-25-9,0.0
2414,医療法人社団石川記念会板橋石川クリニック,03-5914-3850,-,当院かかりつけの透析患者のみ対応,0,東京都板橋区小豆沢3-6-7NK志村坂上ビル2，3階,1.0
2415,イムス板橋リハビリテーション病院,03-3967-1183,-,完全予約制（予約電話受付時間11時～12時）にてかかりつけ患者様に限り、初期診療と抗原定性検査のみ16時～17時の間に行います。,0,東京都板橋区小豆沢3-11-1,0.0
2416,医療法人財団健康文化会小豆沢病院附属本蓮沼診療所,03-3960-4837,-,なし,0,東京都板橋区小豆沢１-７-７,2
2417,医療法人社団明芳会 イムス板橋健診クリニック,03-3967-1515,-,なし,0,東京都板橋区小豆沢2-23-15,0.0
2418,天谷医院板橋診療所,03-3965-9555,-,なし,0,東京都板橋区小豆沢二丁目17番1 平本コーポ102号,0.0
2419,はす花こどもファミリークリニック,03-3960-8287,https://ssc6.doctorqube.com/hasuhana.clinic/,なし,1,東京都板橋区蓮沼町23-3,0.0
2420,医療法人社団篠遠医院,03-3966-4901,-,なし,0,東京都板橋区蓮沼町20番14号1階,0.0
2421,大竹耳鼻咽喉科,03-3969-4733,-,なし,0,東京都板橋区蓮沼町20-11-1階,2
2422,天木診療所,03-3961-3913,-,なし,1,東京都板橋区清水町４７-７,0.0
2423,医療法人社団友晃会 藤田医院,03-3960-2822,-,なし,1,東京都板橋区泉町23-8,0.0
2424,医療法人社団厚優会 こうのファミリーケア・クリニック,03-3965-1649,-,なし,1,東京都板橋区志村3-20-26志村スタービル1階,0.0
2425,石澤内科クリニック,03-3966-1438,-,なし,0,東京都板橋区志村2-10-9,2
2426,まつもとクリニック,03-3558-7117,-,なし,0,東京都板橋区志村2-10-1-1F,2
2427,はすぬま内科,03-5916-1626,-,なし,1,東京都板橋区大原町６-５カリンレジデンス１F,0.0
2428,医療法人社団キンダーリング　えがおこどもクリニック,web予約,https://kinderring.or.jp/,なし,1,東京都板橋区前野町3丁目31-3,0.0
2429,医療法人社団惠星会花岡耳鼻咽喉科医院,03-5392-1086,-,なし,1,東京都板橋区前野町6-27-6,0.0
2430,医療法人社団雄丈会 つづきクリニック,03-3960-0407,-,なし,1,東京都板橋区前野町4-13-13,2
2431,医療法人社団 孝慈会 中台医院,03-3935-0195,-,なし,1,東京都板橋区中台1の4の7,0.0
2432,医療法人社団博佳会 サンシティ耳鼻咽喉科,03-5922-4187,-,なし,1,東京都板橋区中台3-27-7　２F　205号,0.0
2433,森 医院,03-3941-8639,morinaika@gakushikai.jp,検査や対面診療ができないが、熱感や病初期の違和感の時に早く対応して医療に繋がることを重視して向き合いたい。,0,東京都板橋区中台2-17-1-213,0.0
2434,平山医院,03-3932-3598,-,なし,1,東京都板橋区中台1-46-3,0.0
2435,医療法人財団朔望会 常盤台外科病院,03-3960-7211,-,なし,1,東京都板橋区常盤台2-25-20,0.0
2436,風見医院,03-3960-0096,-,令和４年8月15日より８月20日は夏季休診のため、発熱外来は行いません。,1,東京都板橋区常盤台１-１１-１０,0.0
2437,北角診療所,03-3960-3617,-,なし,1,東京都板橋区常盤台3-3-1,0.0
2438,今本クリニック,03-3966-9866,-,なし,1,東京都板橋区常盤台1-19-13,0.0
2439,ときわ台はしもと小児科アレルギー科,03-6454-5415,-,なし,1,東京都板橋区常盤台1-2-3新光常盤台ビル3階,0.0
2440,大久保医院,03-6906-6811,-,なし,1,東京都板橋区常盤台4-10-5,0.0
2441,医療法人社団 明芳会 イムス記念病院,03-3932-9181,-,なし,1,東京都板橋区常盤台4-25-5,0.0
2442,医療法人社団　小﨑会　常盤台らいおん整形外科,03-5915-2020,-,必ず事前にお電話でお問い合わせください。,0,東京都板橋区常盤台1-44-1　BELISTA常盤台1階,0.0
2443,医療法人社団明珠会中川医院耳鼻咽喉科,03-3558-6332,-,当院はコロナ検査（PCR、抗原検査）ともに行っておりません。発熱のある方は受診の前に電話をいただき指定の時間に来院して下さい。,0,東京都板橋区常盤台1-12-1,0.0
2444,医療法人社団櫻美会石川医院,03-3960-3940,-,なし,0,東京都板橋区常盤台１-６１-３,0.0
2445,医療法人社団 希光会 西尾医院,03-3960-4970,-,なし,0,東京都板橋区常盤台３-２６-１５,2
2446,上板橋松山内科クリニック,03-5922-1271,-,なし,0,東京都板橋区常盤台4-30-9宝田ビル1F,0.0
2447,高木内科クリニック,03-3960-3300,-,当院はコロナ検査（PCR、抗原検査）ともに行っておりません。発熱のある方は受診前にお電話いただき指定の時間に来院してください。,0,東京都板橋区常盤台1-33-3,0.0
2448,医療法人社団慈誠会 上板橋病院,03-3933-7191,-,なし,0,東京都板橋区常盤台4-36-9,0.0
2449,医療法人社団 南ときわ台耳鼻咽喉科,03-3956-3371,-,必ずお電話で御予約の上ご来院お願い致します。,1,東京都板橋区南常盤台2-14-11,0.0
2450,弓倉医院,03-3956-1666,-,なし,1,東京都板橋区南常盤台１-７-１２,0.0
2451,医療法人社団和好会金子病院,03-3956-0145,-,発熱外来の密を回避するため、予約時間はお守りください。また、当院に着きましたら、入室する前にお電話ください。,1,東京都板橋区南常盤台1-15-14,0.0
2452,さいしょ小児科,03-5986-1271,-,なし,1,東京都板橋区東新町2-55-4,0.0
2453,斎藤医院,03-3933-0386,-,なし,1,東京都板橋区桜川2-11-5,0.0
2454,医療法人社団健育会竹川病院,03-6413-1300,-,なし,0,東京都板橋区桜川2-19-11,0.0
2455,はちすクリニック,03-5922-5055,-,なし,1,東京都板橋区上板橋1-26-13,0.0
2456,上板橋診療所,03-3933-2201,-,なし,1,東京都板橋区上板橋2-1-8,0.0
2457,山櫻診療所,03-3933-8739,-,なし,0,東京都板橋区上板橋３-１５-５,0.0
2458,医療法人財団 健康文化会 下赤塚診療所,03-3979-6361,-,なし,0,東京都板橋区赤塚2-9-4 MAISON Y.K 1階,2
2459,西台診療所,03-3934-5558,-,令和4年6月1日より変更,0,東京都板橋区西台３-３３-１０,0.0
2460,医療法人社団隆勇会 新河岸クリニック,03-5921-1805,-,なし,0,東京都板橋区新河岸１-３-２-１０１,0.0
2461,小豆沢病院付属高島平診療所,0339323394,-,なし,1,東京都板橋区高島平8-1-1,0.0
2462,板橋区医師会病院,03-3975-8151,-,なし,1,東京都板橋区高島平3-12-6,0.0
2463,医療法人社団樹光会 宮田医院,03-3559-8480,-,なし,1,東京都板橋区高島平8-12-9 メゾンソレイユ101,0.0
2464,渡辺産婦人科医院,03-5399-3008,-,なし,1,東京都板橋区高島平２-３-１４,0.0
2465,クリニック高島平,03-5920-3341,-,なし,1,東京都板橋区高島平8-17-8-102,0.0
2466,医療法人社団 和会 あべこどもクリニック,03-3559-8115,-,なし,1,東京都板橋区高島平1-28-5-2F,0.0
2467,郡医院,03-3975-3438,-,なし,1,東京都板橋区高島平3-8-6,0.0
2468,医療法人社団躍心会 高島平東口クリニック,03-3933-1213,-,お電話での予約のみとなります。予約状況によっては対応できない場合ありますので、ご了承ください。,1,東京都板橋区高島平8-5-10 MAビル3階,0.0
2469,高島平診療所堀口内科小児科,03-3975-4114,-,なし,1,東京都板橋区高島平４-３０-６,0.0
2470,医療法人社団 ごんだクリニック,03-5922-5377,-,なし,1,東京都板橋区高島平2-33-1 ピーコックストア高島平店2階,0.0
2471,高島平かわむらクリニック,03-3933-7700,-,なし,1,東京都板橋区高島平9-18-7,0.0
2472,医療法人社団 明芳会 高島平中央総合病院,03-3936-7451,-,なし,1,東京都板橋区高島平1丁目73番1号,0.0
2473,医療法人社団 新医会 鈴木耳鼻咽喉科,03-3934-9002,-,なし,0,東京都板橋区高島平2-32-2-108,0.0
2474,高島平りゅう医院,03-3931-5311,-,なし,1,東京都板橋区高島平2-21-6,0.0
2475,医療法人社団西台耳鼻咽喉科医院,03-3937-1187,-,なし,0,東京都板橋区高島平1丁目81-12 PEACE西台2階,2
2476,医療法人財団健康文化会 小豆沢病院付属高島平診療所,03-3932-3394,-,なし,0,東京都板橋区高島平8-1-1,2
2477,西台内科,03-5922-5350,-,なし,0,東京都板橋区高島平九丁目7番6号 セトルコート高島平101号,0.0
2478,工藤クリニック,03-3936-0068,-,当院に現在通院中の方に限らせて頂いております。,0,東京都板橋区高島平二丁目32街区2号棟102号,0.0
2479,医療法人社団　正有会　髙橋医院,0339363758,-,来院前に必ずお電話をください。診療状況によっては対応出来ない場合がございますのでご了承ください。,0,東京都板橋区高島平9-17-3,0.0
2480,板橋北クリニック,03-6281-0071,-,なし,0,東京都板橋区高島平8-7-6サンプレジエール202,0.0
2481,医療法人社団ナイズ　キャップスクリニック板橋,web予約,https://mypage.caps-clinic.jp/sp/index.html,なし,1,東京都板橋区徳丸二丁目6番1号イオン板橋ショッピングセンター4階,1.0
2482,みなくちクリニック,03-6785-3791,-,必ずお電話にてご予約ください。,1,東京都板橋区徳丸2-14-8,0.0
2483,ゆう徳丸内科皮膚科,03-6909-7570,-,なし,1,東京都板橋区徳丸4-10-6,0.0
2484,医療法人樹会 ふくはら内科クリニック,03-5398-0324,-,なし,1,東京都板橋区徳丸7-1-1　コモディイイダ徳丸西台店3階　,0.0
2485,ねや内科クリニック,03-5922-5100,-,当院ではPCR検査ならびに抗原検査は行っておりません。診察後、それらの検査が必要と判断した場合には、地域の他の医療機関への紹介を行います。,0,東京都板橋区徳丸５-３-２２,0.0
2486,とくまる在宅クリニック,03-4400-5333,-,なし,0,東京都板橋区徳丸2丁目3番11号あしたばハウス201号,0.0
2487,医療法人社団 ふるた小児クリニック,03-3932-7800,-,なし,0,東京都板橋区徳丸2-21-8,0.0
2488,田幡医院,090-6049-8918,-,なし,0,東京都板橋区徳丸3-13-9,2
2489,耳鼻咽喉科 萩原医院,03-3934-3387,-,なし,0,東京都板橋区徳丸3ー1ー20　1F,0.0
2490,医療法人社団慈誠会 東武練馬中央病院,03-3934-1611,-,診療可能な人数は午前・午後それぞれ3人までです。予約の空きがない場合もありますのでご了承ください。,0,東京都板橋区徳丸3丁目19番1号,0.0
2491,たくみ内科,03-5967-2422,-,なし,0,東京都板橋区四葉2-1-10 四葉メディカルモール103,0.0
2492,医療法人社団英植会木村整形外科,03-3977-1351,-,なし,0,東京都板橋区東京都板橋区三園1-47-7,1.0
2493,北原クリニック,03-3939-0383,-,8/8~8/13までの期間は夏季休暇となります,1,東京都板橋区赤塚７-４-１７,0.0
2494,赤塚耳鼻咽喉科,03-3939-0168,-,なし,0,東京都板橋区赤塚2-1-2,0.0
2495,医療法人社団翔生会 楠医院,03-3939-0096,-,オンライン診療はできません。PCR検査は検査会社に依頼するので、結果が届くまでに数日かかります。通常診療の混雑状況により、検査をするまでにお時間がかかります。,0,東京都板橋区赤塚６-２３-１４,0.0
2496,松月院通りクリニック,03-5968-6011,-,なし,0,東京都板橋区赤塚５-１-４,0.0
2497,赤塚新町クリニック,03-6915-6617,-,なし,1,東京都板橋区赤塚新町2-5-16ヴィルヌーブ赤塚1F,0.0
2498,水野醫院,03-3559-2111,-,なし,0,東京都板橋区赤塚新町１丁目17番１号,0.0
2499,やの内科・小児科クリニック,03-3930-2277,https://yano-c.atat.jp/,新型コロナウイルス感染の可能性が気になる方は，必ず来院前に当院へお電話ください．また，診察予約を取られた方へ，診察に先んじて，当院から電話することがあります．,0,東京都板橋区赤塚新町３丁目１９-５,0.0
2500,医療法人社団浅間会宮下こどもクリニック,03-5967-0415,-,なし,1,東京都板橋区成増2-21-22,0.0
2501,医療法人社団 杉内医院,03-3930-2331,-,なし,1,東京都板橋区成増3-17-16,0.0
2502,医療法人社団多比良医院,03-3975-8139,-,なし,1,東京都板橋区成増4-13-2-1階,0.0
2503,田島クリニック,03-5383-6622,-,電話診療は再診(対面診療後の継続診療)のみ対応。,1,東京都板橋区成増5-18-4,1.0
2504,医療法人社団正風会 小林病院,03-3930-7077,-,なし,1,東京都板橋区成増3-10-8,0.0
2505,なります耳鼻咽喉科,03-3979-4187,-,なし,0,東京都板橋区成増3-9-9,0.0
2506,伊藤内科小児科クリニック,03-3930-5114,-,なし,0,東京都板橋区成増1-17-10,0.0
2507,"医療法人社団聖之会
Waltzクリニック",03-3938-1219,-,なし,0,東京都板橋区成増3-3-5,0.0
2508,医療法人社団耳鼻咽喉科いとうクリニック,03-5968-8733,-,なし,0,東京都板橋区成増2-26-18カーサエール105,0.0
2509,かとう内科クリニック,03-3977-8222,-,なし,0,東京都板橋区成増２-１７-６エクセルK.S.Y１階,0.0
2510,医療法人社団整秀会　田辺整形外科医院,03-5998-0061,-,一般患者様の混雑具合により時間どおり発熱外来を開始できない場合がありますので、事前に必ず電話でご相談ください。,0,東京都板橋区成増3-3-11　成増アクト2-101,0.0
2511,医療法人社団叡宥会 安田病院,03-3939-0101,-,なし,0,東京都板橋区成増1丁目13番9号,2
2512,医療法人社団藤昭会後藤こどもクリニック,03-5917-8550,-,なし,1,東京都板橋区小茂根１-２７-１９,0.0
2513,医療法人社団周生会杉田クリニック,03-3970-6329,-,なし,0,東京都練馬区田柄４-１１-１０,0.0
2514,医療法人社団一優会津久井小児科内科医院,03-3937-1151,-,なし,1,東京都練馬区北町6-27-23-1階,0.0
2515,高橋医院,03-3993-3811,-,お電話で予約をしてからお越しください。空きがない場合もございます。御了承ください。,1,東京都練馬区練馬4-13-5,0.0
2516,練馬第二診療所,03-3991-4670,-,なし,0,東京都練馬区練馬1-6-16,0.0
2517,鈴木クリニック,03-3991-1581,-,なし,0,東京都練馬区練馬1-27-1,0.0
2518,大江戸整形外科内科,03-5912-5355,-,受診希望の先は事前にお電話にてお問合せの上、ご相談ください。当日の診療状況により、対応可能な時間等に調整が必要な旨、ご理解の程よろしくお願い致します。,0,東京都練馬区練馬4-14-13,0.0
2519,医療法人社団 順洋会 武蔵野総合クリニック  練馬,03-3993-7015,-,なし,0,東京都練馬区練馬1-26-1,1.0
2520,医療法人社団郁翠会　牧田医院,web予約,makita-klinic.com,なし,1,東京都練馬区桜台1-45-15Blanc et Noir　1階，2階,0.0
2521,南町医院,03-3993-5251,-,事前の電話でのご予約をお願いいたします（8:30～　当日分のみ）予約の枠に限りがあるためご要望におこたえできない場合もございます　ご了承ください,1,東京都練馬区桜台1-8-8,0.0
2522,医療法人財団秀行会 阿部クリニック,03-3992-1103,-,なし,1,東京都練馬区桜台2-1-7,0.0
2523,医療法人社団宏生会反町医院,03-3991-2969,-,なし,1,東京都練馬区桜台３-１４-１６,0.0
2524,新桜台 内科・外科クリニック,03-3993-9090,-,なし,1,東京都練馬区桜台1-28-8 シースリーモール新桜台2階,0.0
2525,新桜台駅前脳神経外科・内科クリニック,03-6914-7703,-,"当院は一般患者さんを予約診療で行っております。一般患者さんと接触を避けるため、一度、お電話を頂いた上で、
予約を取らせて頂きます。",0,東京都練馬区桜台1丁目28-8　シースリーモール新桜台２Ｆ-３,0.0
2526,新桜台中村ファミリークリニック,03-3991-7131,-,なし,0,東京都練馬区羽沢2-2-14,2
2527,石黒内科クリニック,03-5917-6100,-,なし,0,東京都練馬区小竹町2-81-8,0.0
2528,大野医院,03-3951-8182,-,なし,1,東京都練馬区旭丘1-55-5,0.0
2529,いとう内科クリニック,03-6761-1171,-,事前に、お電話をください。電話にてカルテを作成し、検査時間と検査についてご説明します。,0,東京都練馬区旭丘2-34-15  旭丘ラポール 1F,0.0
2530,医療法人社団孝志会 江古田内科整形外科,03-6431-0030,-,なし,0,東京都練馬区旭丘2-44-6,0.0
2531,練馬総合病院旭丘診療所,03-5982-8022,-,予約制となります。お電話にて予約をお願いします。,0,東京都練馬区旭丘１-３２-９-１Ｆ,0.0
2532,浩生会スズキ病院,03-3557-2001,-,なし,1,東京都練馬区栄町７-１,0.0
2533,医療法人社団桜舞会 井関内科,03-5912-1500,-,なし,1,東京都練馬区豊玉上2-21-13-101,0.0
2534,医療法人社団 真成会 野口医院,03-3994-5018,-,事前にお電話ください。予約枠の上限があり、お受けできない場合もあります。何卒ご了承ください。,0,東京都練馬区豊玉上1-13-6,0.0
2535,医療法人社団文和会 中井医院,03-3991-0657,-,なし,1,東京都練馬区豊玉北5-3-14,0.0
2536,医療法人社団健水会 練馬中央診療所,03-3991-9655,-,なし,1,東京都練馬区豊玉北５-３２-８,0.0
2537,医療法人社団柔和会藤澤こどもクリニック,03-3557-7950,-,来院前に03-3557-7950までお電話をお願いします。予約制です。,1,東京都練馬区豊玉北6-6-6,0.0
2538,森田医院,03-3991-0012,-,なし,1,東京都練馬区豊玉北6-15-19,0.0
2539,ながにし耳鼻咽喉科クリニック,03-5912-0087,-,なし,1,東京都練馬区豊玉北4-26-6Ｄ・Ｓ・Ｔクリーンカーム101,0.0
2540,佐藤クリニック,03-3993-3171,-,"　　来院前にお電話をお願いします。
　予約枠に上限あり、お受けできない場合もあります。ご了承ください。",1,東京都練馬区豊玉北５-３２-４,0.0
2541,城西在宅クリニック・練馬,03-4560-1122,-,なし,0,東京都練馬区豊玉北5-4-3-101,1.0
2542,"すずしろ医療生協　すずしろ診療所
",03-3557-1131,-,なし,0,東京都練馬区練馬区練馬1-15-1,0.0
2543,医療法人社団 三世会 ねぎしクリニック,03-3991-0328,-,なし,0,東京都練馬区豊玉北４ー１９ー６,0.0
2544,練馬桜台クリニック,03-5999-0723,-,なし,0,東京都練馬区豊玉北4-11-9,0.0
2545,医療法人社団晃仁会　内田内科胃腸クリニック,03-5912-1241,-,当面はかかりつけの患者様のみ対応。時間指定がある場合がありますので、必ずお電話にて確認をお願いいたします。,0,東京都練馬区豊玉北5-7-15,0.0
2546,練馬東クリニック,03-5946-2727,-,なし,0,東京都練馬区豊玉北5-14-6 新練馬ビル4階,2
2547,医療法人社団東京白報会 ねりま在宅診療所,03-6914-5572,-,2022年8月末をもちまして休止となります。,0,東京都練馬区豊玉北5-14-6 新練馬ビル4F,0.0
2548,小山小児科・耳鼻咽喉科医院,03-3991-0002,-,なし,0,東京都練馬区豊玉北6-19-1,0.0
2549,秋田医院,03-3991-1151,-,なし,1,東京都練馬区豊玉中4-10-3,0.0
2550,とくでんクリニック,03-3991-1971,-,なし,1,東京都練馬区豊玉南1-10-1,0.0
2551,医療法人社団弘和会歌橋医院,03-3999-6767,-,なし,1,東京都練馬区貫井4-25-31,0.0
2552,医）章黎会よしだ内科クリニック,03-3577-3252,-,発熱や咽頭痛、咳などで受診希望される場合必ず前もって電話でご連絡ください。診療状況によりご要望にお答えできないこともありますのでよろしくお願いいたします。,1,東京都練馬区貫井1-12-5,0.0
2553,富士見堂クリニック,03-5848-5987,-,なし,1,東京都練馬区貫井3-14-6 並木ビル1階,0.0
2554,すずき耳鼻咽喉科,03-3577-9560,-,なし,1,東京都練馬区貫井3-8-4  1階,0.0
2555,藤岡クリニック,03-3970-3884,-,なし,0,東京都練馬区貫井１-７-９,0.0
2556,中村橋耳鼻咽喉科クリニック,03-3926-7298,-,なし,0,東京都練馬区貫井1-7-28高山ビル２階,0.0
2557,笠井内科循環器クリニック,03-3577-8071,-,なし,0,東京都練馬区貫井3-11-12-3Ｆ,0.0
2558,よしなが在宅クリニック,03-5848-9501,-,なし,0,東京都練馬区貫井2-27-23　パラドール中村橋101,0.0
2559,寺門医院,03-3999-4630,-,なし,1,東京都練馬区中村北3-3-5,0.0
2560,医療法人社団隆記会田中医院,03-3998-0011,-,なし,1,東京都練馬区中村北4‐4‐16‐1階,0.0
2561,"医療法人社団ときわ
練馬在宅クリニック",080‐3516‐6722,-,【発熱外来受付の一時停止について】2022年7月27日より当院の発熱外来受付を一時停止しております。また、最新情報につきましては当院HPよりご確認ください。,1,東京都練馬区中村北一丁目5番9号第二永崎ビル1階,0.0
