id,name,phone_number,url,notification,primary_care_doctor,adress,holiday_support
3442,医療法人社団誠江会 田中医院,03-3612-3352,-,なし,1,東京都江戸川区平井6-30-1,0.0
3443,医療法人社団桂医院,03-3682-3035,-,なし,1,東京都江戸川区平井1-17-4,0.0
3444,いなげ小児科クリニック,03-3613-7667,-,なし,1,東京都江戸川区平井5-24-10,0.0
3445,医療法人社団 だいだい 平井すばるクリニック,03-5875-1161,-,遠隔診療は電話診療のみ,1,東京都江戸川区平井三丁目２３番１８号 光井グランドハイツ１階,0.0
3446,医療法人社団 城東桐和会 平井駅前総合クリニック,03-5875-3377,-,遠隔診療は電話診療のみ,1,東京都江戸川区平井三丁目２３番１８号 光井グランドハイツ２階,0.0
3447,親和ハートフルクリニック,0336847150,-,混雑状況により予約が取り難くなる事がありますのでご了承下さい,1,東京都江戸川区平井2-24-16東京育明会ビル１F２F,0.0
3448,医療法人社団東京ハートサミット　東京心臓不整脈病院,03-3638-2301,-,なし,1,東京都江戸川区平井３-２５-１７,0.0
3449,久田医院,03-3681-0081,-,なし,0,東京都江戸川区平井1-27-7,0.0
3450,医療法人社団 清雅会 Shimizu Maternity Clinic,03-3613-5555,-,なし,0,東京都江戸川区平井６-２-３０,1.0
3451,医療法人社団 細波会 波多医院,03-3681-0755,-,なし,1,東京都江戸川区平井1-10-12,0.0
3452,北浦医院,03-3685-1177,-,なし,0,東京都江戸川区平井1-5-7,2
3453,医療法人社団俊爽会 仁愛堂クリニック,03-3613-5548,-,なし,1,東京都江戸川区平井6-15-14,0.0
3454,西外科胃腸科クリニック,03-3682-3756,-,なし,0,東京都江戸川区平井４-１５-２０,0.0
3455,平井ゆうあいクリニック,03-5875-3760,-,なし,0,東京都江戸川区平井3-16-8,2
3456,医療法人社団しろひげファミリー しろひげ在宅診療所,03-5666-4675,-,なし,0,東京都江戸川区南篠崎町2-11-2 ニューサザンクロス1階,0.0
3457,小暮医院,03-3653-5347,-,なし,1,東京都江戸川区興宮町16-13,0.0
3458,医療法人社団和高会 佐々木内科小児科クリニック,03-3653-0850,-,なし,1,東京都江戸川区松本1-11-3,0.0
3459,医療法人社団慶津会江戸川ふれあいクリニック,03-5661-5338,-,なし,0,東京都江戸川区本一色3-6-4 せらび江戸川1階,0.0
3460,速水医院,03-3672-6759,-,なし,1,東京都江戸川区北小岩6-47-6,0.0
3461,皆川内科小児科,03-3671-0030,-,来院前に必ずお電話をください。,1,東京都江戸川区北小岩2-9-12,0.0
3462,医療法人社団茜遥会 目々澤醫院,03-3657-5470,-,なし,1,東京都江戸川区北小岩４-５-８,0.0
3463,医療法人社団あさかぜ会 北小岩胃腸科クリニック,03-3672-2865,-,なし,1,東京都江戸川区北小岩4-8-3,0.0
3464,医療法人社団新穂会　京成小岩駅前クリニック,03-5694-2031,-,なし,1,東京都江戸川区北小岩6-15-4,0.0
3465,ながきこどもクリニック,03-5612-0661,-,なし,1,東京都江戸川区北小岩6-15-5-3F,0.0
3466,京成小岩すまいるクリニック,03-6801-7821,-,なし,1,東京都江戸川区北小岩2-7-4 LANAI PLAZA FIRST STAGE 1階 Ｂ区画,0.0
3467,医療法人社団 泰正会 成光堂クリニック,03-3657-6576,-,なし,1,東京都江戸川区北小岩２-７-６,0.0
3468,医療法人社団 黄耆会 京谷医院,03-3671-8103,-,なし,0,東京都江戸川区北小岩6-17-7,0.0
3469,京成小岩訪問診療所,03-6801-7620,-,なし,0,東京都江戸川区北小岩6-19-4佐藤ビル1階,2
3470,小岩医院,web予約,https://www.489map.com/helios/A6146359/reserve,なし,1,東京都江戸川区東小岩6-21-5,0.0
3471,医療法人社団 玉城医院,03-3657-1011,-,なし,1,東京都江戸川区東小岩6-1-3,0.0
3472,医療法人社団弘仁会　片倉クリニック,03-3658-0221,-,水曜・日曜・祝日は休診となります,1,東京都江戸川区東小岩5-19-12,0.0
3473,医療法人社団杏泉会 塚本医院,03-3657-0864,-,なし,1,東京都江戸川区東小岩5-32-10,0.0
3474,佐藤医院,03-3657-1414,-,なし,1,東京都江戸川区東小岩5-20-12,0.0
3475,医療法人社団 だいだい 東小岩わんぱくクリニック,03-5612-3754,-,遠隔診療は電話診療のみ,1,東京都江戸川区東小岩四丁目５番２号 神奈川ビル１階,0.0
3476,医療法人社団 だいだい 小岩すばるクリニック,03-5693-3349,-,遠隔診療は電話診療のみ,1,東京都江戸川区東小岩四丁目５番４号 金本ビル１階,0.0
3477,医療法人社団 城東桐和会 東小岩げんきクリニック,03-5612-3702,-,遠隔診療は電話診療のみ実施,1,東京都江戸川区東小岩四丁目５番２号 神奈川ビル２階,0.0
3478,社会福祉法人 仁生社 江戸川病院,03-3673-1221,-,現在、予約が取りづらくなっているためかかりつけの方のみ対応しています。,0,東京都江戸川区東小岩2-24-18,0.0
3479,医療法人社団晃勲会白石医院,03-3657-4501,-,なし,0,東京都江戸川区東小岩4-33-16,0.0
3480,医療法人社団 昌葉会 北篠崎クリニック,03-3698-7225,-,なし,1,東京都江戸川区北篠崎2-4-3,0.0
3481,いしホームクリニック,03-5666-1433,-,なし,0,東京都江戸川区西篠崎2-7-30,1.0
3482,"医療法人社団順莉会
小岩駅前みみはなのどクリニック",03-6458-0387,-,発熱外来を受診される方は、電話での予約をお願い致します。,1,東京都江戸川区南小岩７丁目２４-２０　FIRSTA Ⅰ　５階,0.0
3483,渡辺クリニック,03-3657-6284,-,何かあったら来院も可能な距離にお住まいの方に限らせていただきます。,1,東京都江戸川区南小岩5-20-15,0.0
3484,医療法人社団 笹川胃腸内科・石川歯科,03-3672-3150,-,なし,1,東京都江戸川区南小岩8-14-1,0.0
3485,医療法人社団幸訪会　こいわファミリー内科,03-6657-9385,-,当院で陽性診断を受けた患者様の電話再診のみ受付可能です,1,東京都江戸川区南小岩7-24-20ファスタⅠ5階,0.0
3486,三浦内科医院,03-5668-3641,-,なし,0,東京都江戸川区南小岩7-26-15,0.0
3487,玉置医院,03-3657-0266,-,なし,1,東京都江戸川区南小岩3-8-1,0.0
3488,赤上医院,03-3657-1435,-,なし,0,東京都江戸川区南小岩7-18-13,0.0
3489,こいわ内科眼科,03-5876-7803,-,なし,0,東京都江戸川区南小岩2-13-13,2
3490,つむぐクリニック,03-6657-9828,-,なし,0,東京都江戸川区南小岩8丁目6番2号　本間ビル101号室,0.0
3491,"医療法人財団岩井医療財団
岩井整形外科内科病院",03-5694-6211,-,月曜日～木曜日対応可（お電話にて事前にご連絡ください）,0,東京都江戸川区南小岩8-17-2,0.0
3492,篠﨑医院,03-3657-6379,-,なし,1,東京都江戸川区西小岩１-２７-６,0.0
3493,長山医院,03-3657-8789,-,発熱外来は全て予約制です午前は10:30迄　午後は4:30迄に電話で予約してください、その際保険証もご用意ください、定員になりましたらお断りします、,1,東京都江戸川区西小岩3-21-11,0.0
3494,医療法人社団 望星会 小岩駅前診療所,03-3657-6395,-,なし,1,東京都江戸川区西小岩1-25-11,0.0
3495,医療法人社団燦明会 大木クリニック,03-5693-0600,-,なし,1,東京都江戸川区西小岩1-28-18-102,0.0
3496,医療法人社団 一翠会 みながわクリニック,03-5612-2151,-,なし,1,東京都江戸川区西小岩4-9-5,0.0
3497,医療法人社団　望星会　小岩駅前診療所,03-3657-6395,-,なし,1,東京都江戸川区西小岩1丁目30番4号,0.0
3498,訪問診療わっしょいクリニック,03-6458-0873,-,なし,0,東京都江戸川区西小岩1-30-16三幸ビル４F,0.0
3499,北澤耳鼻咽喉科医院,03-3673-8733,-,なし,0,東京都江戸川区西小岩3-32-13,0.0
3500,医療法人社団厚生会 西小岩内科医院,03-3658-3782,-,なし,0,東京都江戸川区西小岩3-5-3,2
3501,医療法人社団つむぎ会 守島医院,03-3671-3711,-,なし,1,東京都江戸川区西小岩1-16-6,0.0
3502,医療法人社団 慈陽会 福田医院,03-3672-7311,-,なし,0,東京都江戸川区西小岩1-6-14,0.0
3503,医療法人社団ゆい　トータルケアクリニック,0356125188,-,受診前に電話予約必須,0,東京都江戸川区西小岩1-25-15　サシバビル1階,0.0
3504,医療法人社団 桐和会 篠崎駅前クリニック,03-5666-1331,-,遠隔診療は電話診療のみ実施しています。,1,東京都江戸川区篠崎町二丁目７番１号 イーストハイム篠崎１階,0.0
3505,医療法人社団伸愛会 いいづか小児科,03-5243-5888,-,なし,1,東京都江戸川区篠崎町７-２４-７-２階,0.0
3506,しのざき耳鼻咽喉科クリニック,03-5243-8177,-,なし,1,東京都江戸川区篠崎町2-7-1 イーストハイム篠崎2階,0.0
3507,医療法人社団 だいだい 篠崎駅前わんぱくクリニック,03-5879-8871,-,遠隔診療は電話診療のみ,1,東京都江戸川区篠崎町二丁目７番１５号 エスタシオン篠崎１階,0.0
3508,医療法人社団 城東桐和会 篠崎駅前にこにこクリニック,03-3677-7773,-,遠隔診療は電話診療のみ,1,東京都江戸川区篠崎町二丁目７番１５号 エスタシオン篠崎１階,1.0
3509,高野医院,0336707550,-,なし,0,東京都江戸川区篠崎町4-12-12,0.0
3510,医療法人社団養成会 篠崎医院,03-5666-8851,-,なし,1,東京都江戸川区篠崎町7-21-8 江戸鉄第二ビル1F,2
3511,医療法人社団城東桐和会 東京さくら病院,03-5664-1701,-,なし,1,東京都江戸川区東篠崎1-11-1,0.0
3512,エムズこどもクリニック瑞江,web予約,http://www.ms-kodomo.clinic/,ホームページお知らせの「発熱のある方」をお読みのうえお越しください。保護者の方は診察・処方できません。祝日は日曜日と同じ受付時間です,1,東京都江戸川区南篠崎町3-1-3 瑞江KRビル2階,1.0
3513,けい内科クリニック谷口内科,０３-６６３８-７０２２,-,なし,1,東京都江戸川区南篠崎町3-6-4,0.0
3514,医療法人社団信康会 入江医院,03-3676-2433,-,なし,1,東京都江戸川区南篠崎町1-6-4,0.0
3515,医療法人多仁会 はるやま小児科,03-3679-1188,-,なし,1,東京都江戸川区南篠崎町2‐10‐1カームコート１０１A,0.0
3516,医療法人社団瑞香会 瑞江ゆうあいクリニック,03-5243-5339,-,なし,0,東京都江戸川区南篠崎町２丁目９-７,0.0
3517,医療法人社団美友梨会 福田クリニック,03-3679-2011,-,なし,0,東京都江戸川区南篠崎町2-38-13,2
3518,アンヌ小児科,03-3672-1071,-,なし,1,東京都江戸川区東松本1-14-9,0.0
3519,若葉みらいクリニック,03-5879-7700,-,なし,0,東京都江戸川区鹿骨4-15-17,0.0
3520,東京東病院,03-5636-3030,-,なし,1,東京都江戸川区鹿骨3-20-3,2
3521,医療法人社団 木かげ会 わたなべ医院,03-3656-3232,-,なし,0,東京都江戸川区江戸川4-22-4,0.0
3522,一般社団法人江戸川区医師会附属診療所,03-5667-7775,-,なし,0,東京都江戸川区西瑞江5-1-6,1.0
3523,医療法人社団 ナイズ キャップスクリニック北葛西,web予約,https://caps-clinic.jp/yoyaku/,なし,1,東京都江戸川区北葛西五丁目１５番２号,1.0
3524,くれもとクリニック,03-5658-8777,-,なし,1,東京都江戸川区北葛西4-1-45カーサ控井102号,0.0
3525,社会医療法人社団森山医会 森山記念病院,03-5679-1211,-,受付は当日の電話予約のみ。詳しくは病院HPをご覧ください,1,東京都江戸川区北葛西四丁目３番１号,1.0
3526,しんでん耳鼻咽喉科医院,03-6411-4133,-,なし,1,東京都江戸川区西葛西８-１２-１７ 101,2
3527,たべ内科クリニック,03-6456-0862,-,"
",0,東京都江戸川区北葛西１-３-２５,0.0
3528,医療法人社団青木クリニック,03-5878-3063,-,なし,1,東京都江戸川区宇喜田町1039-1エクセラ-ジュ船堀102号,0.0
3529,医療法人社団 佐藤医院,03-3688-7460,-,なし,1,東京都江戸川区中葛西1-4-16,0.0
3530,医療法人社団家宏会 沢医院,03-3680-8765,-,なし,1,東京都江戸川区中葛西1-31-53,0.0
3531,星田小児クリニック,03-3680-2028,-,なし,1,東京都江戸川区中葛西２-３-１０,0.0
3532,医療法人桐司会矢島循環器内科,03-5667-2525,-,なし,1,東京都江戸川区中葛西5-38-10シャトレーゼ１階,0.0
3533,医療法人社団 清正会 飯塚内科医院,03-3688-0395,-,なし,1,東京都江戸川区中葛西３丁目１６番６号,0.0
3534,医療法人社団千秋双葉会 東京みらいクリニック葛西,03-3680-5560,-,なし,1,東京都江戸川区中葛西5丁目-34-8 須賀ビル1階,0.0
3535,葛西のかなめクリニック,03-6808-5881,-,診察日が祝日の場合、土曜・日曜と同じ診療時間となります。お手数ではございますが、電話にてご予約をお取りください。直接来院いただきましてもご案内しかねます。,1,東京都江戸川区中葛西5-20-14水戸ビル１F,1.0
3536,葛西ホームケアクリニック,03-6808-7282,-,なし,0,東京都江戸川区中葛西8丁目18番12号アジュール101号室,0.0
3537,医療法人社団順照会　山本小児クリニック,03-3688-8600,-,なし,0,東京都江戸川区中葛西３-１１-２０,0.0
3538,医療法人社団俊爽会 葛西内科皮膚科クリニック,03-5679-8211,-,なし,1,東京都江戸川区中葛西３-１６-１７-１F,0.0
3539,医療法人社団ギブネス 葛西よこやま内科・呼吸器内科クリニック,03-3877-1159,-,なし,1,東京都江戸川区東葛西5-1-2 第2吉田ビル3階,0.0
3540,医療法人社団希和会葛西内科クリニック,03-3687-5755,-,なし,1,東京都江戸川区東葛西5-1-4篠原ビル3Ｆ,0.0
3541,医療法人社団 安藤内科医院,03-3689-7309,-,なし,1,東京都江戸川区東葛西6-15-16,0.0
3542,"医療法人社団HMS
はら耳鼻咽喉科",03-3680-0304,-,コロナウィルス感染の症状（発熱、咳、咽頭痛、倦怠感等）がある方、濃厚接触者と疑われる方はまずは03-3334-6661で問い合わせて下さい。,1,東京都江戸川区東葛西6-11-3,0.0
3543,医療法人社団 二木耳鼻咽喉科医院,03-3877-4133,-,なし,0,東京都江戸川区東葛西 5-13-9,2
3544,医療法人社団大佑会　明育小児科,03-3686-0359,-,必ず電話予約をしてください,0,東京都江戸川区東葛西2-3-16,1.0
3545,柴山泌尿器科・内科クリニック,03-5675-7223,-,なし,0,東京都江戸川区東葛西6丁目1番17号,0.0
3546,葛西小児科,03-5675-2501,-,なし,0,東京都江戸川区東葛西6-23-17プレシャスハイム1階,0.0
3547,医療法人社団フレシェア まつおクリニック,03-5667-4181,-,なし,0,東京都江戸川区東葛西2-9-10,0.0
3548,葛西そらまめクリニック,03-6808-6080,-,なし,0,東京都江戸川区東葛西5-19-3,1.0
3549,たろうクリニック葛西,03-6808-9059,-,なし,0,東京都江戸川区東葛西6-4-3第3ロイヤルシラコビル201号,0.0
3550,医療法人財団南葛勤医協　葛西みなみ診療所,03-5679-7144,-,なし,1,東京都江戸川区南葛西2-12-1　かさい保健医療福祉ビル2階,0.0
3551,医療法人社団周桃会 まなべファミリークリニック,03-3869-1525,-,なし,1,東京都江戸川区南葛西６-１２-７,0.0
3552,医療法人社団結草会 みやのこどもクリニック,03-3869-4133,-,なし,1,東京都江戸川区南葛西2-18-27,0.0
3553,"医療法人社団信正会
敷井耳鼻咽喉科クリニック",03-5676-4787,-,なし,1,東京都江戸川区南葛西６-１５-１４エスケービル１階,0.0
3554,日本私立学校振興・共済事業団 東京臨海病院,03-5605-8811,-,なし,0,東京都江戸川区臨海町１-４-２,0.0
3555,清新南クリニック,03-3877-8665,-,なし,1,東京都江戸川区清新町1-1-6-101,0.0
3556,清新北診療所,03-3878-3001,-,なし,0,東京都江戸川区清新町１丁目４-１-１０６,0.0
3557,医療法人社団 ナイズ キャップスクリニック西葛西,web予約,https://caps-clinic.jp/yoyaku/,なし,1,東京都江戸川区西葛西六丁目１２番１号 関寅ビル第２ １階,1.0
3558,医療法人社団博清会 中鉢内科・呼吸器内科クリニック,03-3687-1161,-,なし,1,東京都江戸川区西葛西6-13-7 第7山秀ビル3階,0.0
3559,医療法人社団愛優会 西葛西三丁目診療所,03-3869-1465,-,なし,1,東京都江戸川区西葛西3-11-8 第五サンキビル102号,0.0
3560,医療法人社団なかにし小児科クリニック,03-3675-6678,-,なし,1,東京都江戸川区西葛西5-1-8,0.0
3561,医療法人社団宗仁会　スミレ小児科・アレルギー科医院,03-5679-8711,-,なし,1,東京都江戸川区西葛西4-2-34　メディカルプラザ西葛西2F,0.0
3562,医療法人社団 だいだい 西葛西わんぱくクリニック,03-5679-7681,-,遠隔診療は電話診療のみ,1,東京都江戸川区西葛西三丁目１５番１３号 第一江の本ビル２階,0.0
3563,医療法人社団桐司会 おがはら循環器・内科,03-3680-2525,-,なし,1,東京都江戸川区西葛西3-15-5 第10山秀ビル 1階,0.0
3564,しゅんしゅんキッズクリニック,03-5658-3601,https://ssc7.doctorqube.com/ssk-clinic/,なし,1,東京都江戸川区西葛西6-6-1,0.0
3565,"医療法人　だいだい
タムス耳鼻科クリニック西葛西",03-6808-8220,-,遠隔診療は電話診療のみ,1,東京都江戸川区西葛西３-１５-１３　第一江の本ビル１F,0.0
3566,医療法人社団　慈映会　西葛西メディカルクリニック,03-3686-3637,-,ホームページよりLINEの友だち登録後「オンライン診療希望」とLINE、保険証・ご住所の分かる身分証明書を添付。ビデオ通話で診療いたします。※予約不可,1,東京都江戸川区西葛西6-18-3KIRAKU2　B棟1階-A,0.0
3567,えんどう医院,03-3675-0330,-,なし,0,東京都江戸川区西葛西3-19-5,0.0
3568,宮澤クリニック,03-3878-0826,-,なし,1,東京都江戸川区西葛西6-18-3 KIRAKU２ A棟 １F,0.0
3569,麻生小児科医院,03-5659-5220,-,なし,0,東京都江戸川区西葛西６-９-１２-２F,0.0
3570,医療法人社団淳風会 渡内科胃腸科,03-5667-1653,-,なし,0,東京都江戸川区西葛西6-9-12,0.0
3571,博愛ホーム診療所,03-3675-1208,-,なし,0,東京都江戸川区西葛西8-1-1,2
3572,菅谷クリニック,03-3688-3678,-,なし,0,東京都江戸川区西葛西7-10-16,0.0
3573,酒井内科・神経内科クリニック,03-6808-2807,-,なし,0,東京都江戸川区西葛西6-15-20 アイビーハイツ２F,0.0
3574,西葛西駅前家族のクリニック,03-5679-7851,-,なし,0,東京都江戸川区西葛西３-１５-１３第一江の本ビル３階,0.0
3575,医療法人社団済安堂　西葛西・井上眼科病院,03-5605-2100,-,要電話予約,0,東京都江戸川区西葛西3-12-14,0.0
3576,社会医療法人社団森山医会　森山脳神経センター病院,03-3675-1211,-,要予約。直接来院不可。,0,東京都江戸川区西葛西7-12-7,0.0
3577,アンカークリニック船堀,web予約,https://anchor-clinic.jp/,なし,1,東京都江戸川区船堀4-3-6-101,0.0
3578,飯室皮膚科,03-5605-3375,-,なし,1,東京都江戸川区船堀一丁目4番13号　シャンサール船堀2階,0.0
3579,医療法人社団宗仁会　さくら医院,03-5674-8733,-,なし,1,東京都江戸川区船堀3-5-7 トキビル3階,0.0
3580,医療法人社団順光会さとう小児クリニック,0356581177,-,なし,1,東京都江戸川区船堀３-３-１,0.0
3581,医療法人社団　鳳和会　船堀橋クリニック,090-3222-4447発熱外来専用,-,なし,1,東京都江戸川区船堀3-7-22　イリップス船堀103,0.0
3582,船堀ゆり医院,03-5605-3301,-,なし,1,東京都江戸川区船堀1-4-13 シャンサール船堀2F,0.0
3583,医療法人社団順禮拓海会 江戸川ホームケアクリニック,03-5667-6221,-,なし,1,東京都江戸川区船堀４-３-６ リベール船堀６階,0.0
3584,医療法人社団 葛西中央病院,03-3680-8121,-,なし,1,東京都江戸川区船堀7丁目10番3号,0.0
3585,浅岡医院,03-5696-3363,-,なし,0,東京都江戸川区船堀3丁目10番7号,0.0
3586,新小岩クリニック船堀,03-3688-9901,-,なし,0,東京都江戸川区船堀4-4-24,2
3587,医療法人社団 樹亘会 船堀南口サザンパーク内科,03-3686-8022,-,なし,0,東京都江戸川区船堀3-8-1-1F,0.0
3588,奥澤医院,03-3877-5210,-,発熱患者の診察・検査の電話予約は診療受付終了時間の1時間前までです。時間内でも一定数に達した場合はお断りする可能性があります。,0,東京都江戸川区船堀４-１０-７,0.0
3589,医療法人社団なぎさ診療所,03-3675-2801,-,なし,0,東京都江戸川区南葛西７-２-２,2
3590,医療法人財団良心会　青梅成木台病院,0428744111,-,かかりつけ患者様のみ対応。受診の際には必ず事前に電話にてご連絡下さい。その際に受診の手順等をご確認下さい。,0,東京都青梅市成木一丁目447番地,0.0
3591,"医療法人財団岩尾会　東京青梅病院
",0428747111,-,当院にかかりつけの患者様は検査が可能ですが、受診の際には必ず事前の電話連絡により当院の診療手順の指示を仰いでください。,0,東京都青梅市富岡３丁目１２５４番地,0.0
3592,"医療法人社団長生会
小曽木診療所　",0428-74-5340,-,なし,0,東京都青梅市小曽木4丁目2787-3,0.0
3593,きくち耳鼻咽喉科クリニック,0428-32-4187,-,なし,0,東京都青梅市今寺5-12-3,2
3594,医療法人社団 佳成会 東原診療所,0428-33-9250,-,なし,0,東京都青梅市今寺5-10-46,2
3595,医療法人社団仁成会　高木病院,0428-31-5255,-,かかりつけ患者様のみとなります。必ずお問い合わせの上ご来院頂けますようお願い申し上げます。,0,東京都青梅市今寺5-18-19,0.0
3596,大堀医院,0428-31-9098,-,なし,0,東京都青梅市今井5-2440-178,2
3597,青梅耳鼻咽喉科,0428-34-9833,-,なし,1,東京都青梅市新町2-16-2,0.0
3598,医療法人社団福聚会　しんまち総合クリニック,0428-78-2323,-,定期受診，初診，各種予防接種，（6月～11月まで）特定健診，会社健診の等方と発熱外来と時間を分けて感染予防対策に出来る限り努めて診察しております。,1,東京都青梅市新町2-18-7,0.0
3599,医療法人社団　輝真会　ホームケアクリニック青梅,0428-32-3663,-,なし,0,東京都青梅市新町3-66-3,0.0
3600,野本医院,0428-31-7155,-,なし,1,東京都青梅市新町5-11-2,0.0
3601,医療法人社団 遼清会 みしま泌尿器科クリニック,0428-30-3567,-,なし,0,東京都青梅市新町3-3-1宇源ビル2F,2
3602,医療法人社団 輝真会 ホームケアクリニック青梅,0428-34-9608,-,なし,0,東京都青梅市新町2-21-12,2
3603,医療法人社団淳心会 ゆだクリニック,0428-30-0880,-,なし,0,東京都青梅市新町6-5-1,0.0
3604,医療法人財団岩尾会東京海道病院,0428-32-0111,-,当院にかかりつけの患者様は検査が可能ですが、受診の際は必ず事前の電話連絡により、当院の診察手順の指示を仰いでください。,0,東京都青梅市末広町一丁目4番5,0.0
3605,中島内科・循環器科クリニック,0428-20-2611,-,なし,0,東京都青梅市師岡町3-19-13,0.0
3606,荒巻医院,0428-24-8561,-,なし,0,東京都青梅市野上町4-3-6,0.0
3607,医療法人社団 彩葉会 なごみクリニック,0428-31-8038,-,なし,1,東京都青梅市河辺町8-13-19,0.0
3608,医療法人社団ナルケンキッズクリニック,0428-21-0252,-,なし,0,東京都青梅市河辺町４-２０-４-１F,0.0
3609,河辺駅前クリニック,0428-21-5588,-,なし,0,東京都青梅市河辺町10-11-1 102号,0.0
3610,青梅市立総合病院,0428-22-3191,-,まずは、かかりつけ先か青梅休日診療所へご相談ください。なお、当院は緊急治療を優先しているため、軽症・無症状・濃厚接触の方のＰＣＲ検査は原則実施しておりません。,1,東京都青梅市東青梅4-16-5,1.0
3611,青梅市休日夜間診療所,0428-20-7708,-,受診の際は診療時間内にお電話ください。感染対策のため受診予約数を制限していますので、受付終了（診療終了の１５分前）前でも予約の受付を終了することがございます。,1,東京都青梅市東青梅1丁目167番地の1,1.0
3612, 医療法人社団　不二会　野村医院,0428-23-8741,-,なし,0,東京都青梅市東青梅1-7-7清水ビル2F,0.0
3613,医療法人社団救人会 東青梅診療所,0428-25-8651,-,なし,0,東京都青梅市東青梅1-7-5,0.0
3614,進藤医院,0428-78-3111,-,電話のみ。保健所等からの依頼のみ。,1,東京都青梅市千ヶ瀬町6-797-1,0.0
3615,医療法人社団 久遠会 友田クリニック,0428-25-1173,-,なし,0,東京都青梅市友田町３丁目１３６番地１,0.0
3616,医療法人社団睦和会　下奥多摩医院,0428-22-2580,-,受診の際は事前にお電話にてお問い合わせ下さい。診療は曜日・時間・人数に限りがありますのでご確認下さい。,1,東京都青梅市長淵４-３７６-１,0.0
3617,梅郷診療所,0428-76-0112,-,なし,0,東京都青梅市梅郷三丁目７５５-１,2
3618,大河原森本医院,0428-22-2047,-,なし,1,東京都青梅市仲町251,0.0
