id,name,phone_number,url,notification,primary_care_doctor,adress,holiday_support
1199,世田谷公園前クリニック,03-5787-6110,-,なし,1,東京都世田谷区下馬1-40-14　1F,0.0
1200,アイ・ユーこどもクリニック,03-5779-8774,-,受診ご希望の方は、必ずお電話にてご連絡下さい。,1,東京都世田谷区下馬1-55-6 メゾンドルミエール1階,0.0
1201,しらきメディカルクリニック,03-6453-2707,-,なし,1,東京都世田谷区下馬2-44-7 エクセルコート下馬 1F,0.0
1202,医療法人社団シンセリティいなみ小児科,03-3421-4885,-,なし,1,東京都世田谷区下馬３-１０ -７,0.0
1203,三宿通りこどもクリニック,03-3413-1155,-,なし,1,東京都世田谷区下馬２-２７-１３レジディア三宿１F,0.0
1204,せたがや下馬クリニック,03-6413-8471,https://clinics-app.com/clinic/615591b4872ad86ba34cb2b7,院内でPCR検査可能です。１時間で検査結果が出ます。受診前にお電話を頂き受診時間をご相談させてい下さい。,1,東京都世田谷区下馬3-33-8,0.0
1205,みくに内科眼科クリニック,03-3411-3920,-,なし,0,東京都世田谷区下馬1-45-17,0.0
1206,西條クリニック下馬,03-3421-4386,-,コロナ検査は当院かかりつけ患者様のみ対象となります。,0,東京都世田谷区下馬6-31-19,0.0
1207,ホームアレークリニック,03-6859-2800,-,なし,0,東京都世田谷区下馬6-17-12 セトル学芸大学1F,2
1208,加藤クリニック,03-3414-9688,-,なし,1,東京都世田谷区野沢2ー14ー5,0.0
1209,医療法人社団清啓会林内科外科医院,03-3421-2136,-,なし,0,東京都世田谷区野沢3-23-1,2
1210,野沢３丁目内科,03-5779-8255,-,抗原定性検査、PCR検査。電話予約制になります。感染予防のため一定数以上の場合はお断りさせて頂くことがございます、ご了承下さい。,0,東京都世田谷区野沢3-1-16,0.0
1211,野沢耳鼻咽喉科,03-6805-5672,-,なし,0,東京都世田谷区野沢3-39-12 野沢ビル1階,0.0
1212,医療法人社団ダイアステップ たけおクリニック,web予約,https://www.takeo-clinic.com/online.html,なし,1,東京都世田谷区太子堂4-22-7,0.0
1213,医療法人社団ウェルブレス会 三茶クリニック,03-5431-7372,-,なし,1,東京都世田谷区太子堂4-24-11 プラザハウス1階,0.0
1214,医療法人社団育真会 いば小児科,03-3413-4976,-,なし,1,東京都世田谷区太子堂3-15-3 ﾛｲﾔﾙﾊｲﾂ103,0.0
1215,医療法人社団 爽樹会 樹のはなクリニック,03-5433-3388,-,PCR検査については当院の定期訪問診療の方のみが対象となっている。,1,東京都世田谷区太子堂2-26-2,0.0
1216,パークサイド脳神経外科クリニック,03-3414-3300,-,なし,1,東京都世田谷区太子堂１丁目３番３９号 B1F,0.0
1217,医療法人社団 小日向 うめはらこどもクリニック,03-6809-7878,-,なし,1,東京都世田谷区太子堂3-38-18 ブリリアイスト三軒茶屋ブラッサムテラス １F,0.0
1218,いいむろ内科クリニック,03-3487-1166,-,なし,1,東京都世田谷区太子堂3-28-16,0.0
1219,キラリこどもクリニック,03-3418-1010,-,なし,1,東京都世田谷区太子堂3-1-24ディアコート三軒茶屋101,0.0
1220,医療法人社団　小森クリニック,03-3412-8770,-,なし,0,東京都世田谷区太子堂5-11-4,0.0
1221,医療法人財団青葉会 青葉病院,03-3419-7111,-,なし,0,東京都世田谷区太子堂２-１５-２,2
1222,小俣内科クリニック,03-5432-3690,-,なし,1,東京都世田谷区太子堂2-19-3 仙田ビル1F,0.0
1223,三茶医院め・みみはな,03-3795-9005,-,なし,0,東京都世田谷区太子堂4-23-13-5階,2
1224,医療法人社団 涼音会 山田耳鼻咽喉科,03-3424-0506,-,なし,0,東京都世田谷区太子堂4-23-12 井上ビル３階,0.0
1225,なな彩クリニック,03-6805-5015,-,なし,0,東京都世田谷区太子堂2丁目16番6号 三恵ビル6階,0.0
1226,亀井クリニック,03-3413-7077,-,当日のみの電話の予約制になります。検査当日に結果を対面で説明します。感染予防のため一定人数以上の場合はお断りをさせて頂くことがあります。ご了承ください。,1,東京都世田谷区三宿1-8-19,0.0
1227,清水小児科医院,03-3421-5696,-,なし,1,東京都世田谷区上馬4-27-7,0.0
1228,近藤内科クリニック,03-3411-1310,-,なし,1,東京都世田谷区上馬2-28-16,0.0
1229,医療法人社団　健隆会　石橋医院,03-3410-3377,-,受診ご希望の方は診療時間内にあらかじめお電話ください。,1,東京都世田谷区上馬1-11-9,0.0
1230,NES駒沢クリニック,03-6450-7730,-,なし,0,東京都世田谷区上馬4-5-6 3階,1.0
1231,駒沢・風の診療所,03-5712-0012,-,なし,0,東京都世田谷区上馬4-4-1芙蓉ビル1階,0.0
1232,医療法人社団花橘会みんなのクリニック三軒茶屋,03-6453-2390,-,なし,0,東京都世田谷区上馬2-29-20戸谷ビル1F,0.0
1233,一般財団法人平和協会駒沢病院,03-3424-2515,-,なし,1,東京都世田谷区駒沢2-2-15,0.0
1234,医療法人社団なでしこ会 駒沢みみ・はな・のどクリニック,03-5430-4133,-,なし,1,東京都世田谷区駒沢4-18-19,1.0
1235,西澤内科クリニック,03-5433-2817,-,なし,0,東京都世田谷区駒沢 1-6-17,2
1236,駒沢ヒロタクリニック,03-5433-8300,-,なし,0,東京都世田谷区駒沢1-2-25　駒沢1.2ﾋﾞﾙ3Ｆ,0.0
1237,こまざわレディースクリニック,03-6805-2881,-,なし,0,東京都世田谷区駒沢1-19-8 アーバネスト駒沢2F,0.0
1238,医療法人社団英誠会 駒沢公園内科クリニック,03-5779-6603,-,なし,0,東京都世田谷区駒沢４-１-１ノア駒沢１階,0.0
1239,アット・ホームクリニック,03-6413-8917,-,なし,0,東京都世田谷区駒沢2-34-2,2
1240,"医療法人社団高薫会
かおり子どもクリニック",03-5431-5656,-,なし,0,東京都世田谷区駒沢３-１-１４　駒沢パークマンション１階,0.0
1241,ひかりクリニック,03-5426-7888,-,前もって必ず電話でご予約を取ってください。,1,東京都世田谷区新町3-22-4,1.0
1242,医療法人社団プラタナス桜新町アーバンクリニック,03-3429-1192,-,発熱外来の予約受付時間は9:00-1１:00となっています。,1,東京都世田谷区新町３-２１-１さくらウェルガーデン２階,0.0
1243,桜新町こどもクリニック,03-5450-1515,-,なし,1,東京都世田谷区新町3-2-1ラフィーネ桜新町１階,0.0
1244,松尾内科クリニック,03-5717-7272,-,なし,0,東京都世田谷区用賀2-10-14 フォレスト446  1F,2
1245,医療法人社団健身会 さくら中央クリニック,03-6413-9290,-,なし,0,東京都世田谷区新町2-6-6,0.0
1246,さくらキッズくりにっく,03-5451-0016,-,なし,1,東京都世田谷区桜新町2-10-4ミケアビル２F,0.0
1247,医療法人社団桜晴会 池上内科循環器内科クリニック,03-5426-6550,-,なし,1,東京都世田谷区桜新町1-11-5 HANAKIKUビル１階,0.0
1248,洵和会 桜新町サカベ内科循環器科クリニック,03-5799-6672,-,なし,1,東京都世田谷区桜新町2-9-6 BLOSSOM 桜新町 3F,0.0
1249,とも内科クリニック,03-5451-7700,-,他の患者さんとの接触をさけるため、受診前に、必ずお電話でご予約をお取りください。,1,東京都世田谷区桜新町２-１０-４ ２階,0.0
1250,医療法人社団翔未会桜新町クリニック,03-5706-4321,-,なし,0,東京都世田谷区桜新町1-7-6,0.0
1251,あずクリニック桜新町,03-6809-8372,-,小児科のみ対応可能です。/部屋の調整がつかない場合は、診察対応ができないこともあります。,0,東京都世田谷区桜新町1-8-7,0.0
1252,医療法人社団 英寿会 深沢クリニック,03-3426-8253,-,なし,1,東京都世田谷区弦巻2-39-3,0.0
1253,医療法人社団さくら会 世田谷中央病院,03-3420-7111,-,なし,1,東京都世田谷区世田谷1-32-18,0.0
1254,世田谷子どもクリニック,03-5799-1582,-,電話予約・電話診療のみ実施,1,東京都世田谷区世田谷3-6-14-101,0.0
1255,世田谷総合クリニック,03-3706-5518,-,なし,1,東京都世田谷区世田谷4-14-32エバガーデン３Ｆ,0.0
1256,医療法人社団ふじこ会　ふじいこどもクリニック,03-5477-3377,-,なし,1,東京都世田谷区世田谷4-1-3世田谷医療COMMUNITY4階402,0.0
1257,浅川クリニック,03-3420-0032,-,なし,0,東京都世田谷区世田谷1-3-8,0.0
1258,医療法人社団クレッセント つだ小児科クリニック,03-5477-7736,-,なし,0,東京都世田谷区世田谷4ー5ー8 アスクル世田谷ネクステージ1F,0.0
1259,内科小久保医院,03-5426-3183,-,なし,0,東京都世田谷区世田谷4丁目20-11ステイジア世田谷101,2
1260,ながたクリニック,03-5477-1128,-,なし,0,東京都世田谷区世田谷４-１-３ 世田谷医療COMMUNITY 3F,0.0
1261,羽田内科医院,03-5477-3901,-,なし,1,東京都世田谷区豪徳寺１-４６-２０,0.0
1262,医療法人社団頌和会村田医院,03-3425-2612,-,なし,1,東京都世田谷区豪徳寺2-16-25,0.0
1263,医療法人社団仁利会こうらクリニック,03-3425-2333,-,なし,1,東京都世田谷区豪徳寺1-23-22,0.0
1264,"
つぼ内科おなかクリニック",03-3425-0587,-,なし,1,東京都世田谷区梅丘2-23-30,0.0
1265,鴻上内科医院,03-3420-5219,-,なし,1,東京都世田谷区梅丘1-11-3,0.0
1266,的場医院,03-3420-3207,-,なし,1,東京都世田谷区梅丘1-21-2,0.0
1267,ふたばこどもクリニック,03-5426-1021,-,なし,1,東京都世田谷区梅丘１-２４-１２ ピュアライン第七ビル２F,0.0
1268,梅ヶ丘駅前クリニック,03-5477-1192,-,なし,1,東京都世田谷区梅丘1-25-1-2階,0.0
1269,梅丘内科,03-5477-0302,-,かかりつけの患者様のみ受け付けております。,0,東京都世田谷区梅丘2-28-12,0.0
1270,加藤医院,03-3420-4863,-,なし,0,東京都世田谷区梅丘1-57-11,2
1271,医療法人社団 高島・山田クリニック,03-3419-2396,-,なし,1,東京都世田谷区若林4-16-15,0.0
1272,若林ゆうクリニック,03-3410-1120,-,診療時間内に必ずお問い合わせください。かかりつけの患者様が優先。通常診療と同時に行っているため検査人数に上限がありお断りする可能性があります。,1,東京都世田谷区若林5-14-6 若林ゆうビルディング2階,0.0
1273,医療法人社団佳清会 野村クリニック,03-3795-1511,-,なし,1,東京都世田谷区若林4-21-15 みなとビルヂング１Ｆ,0.0
1274,神津内科クリニック,03-5481-4114,-,なし,0,東京都世田谷区若林5-4-7,0.0
1275,佐中医院,03-3421-9728,-,なし,0,東京都世田谷区若林4-17-7,0.0
1276,こいずみ耳鼻咽喉科医院,03-3419-5239,-,なし,0,東京都世田谷区若林4ー19ー1,2
1277,園田耳鼻咽喉科医院,03-5433-3318,-,なし,1,東京都世田谷区三軒茶屋１-３５-２０,0.0
1278,医療法人社団周駒会 井上外科内科医院,03-3424-3360,-,なし,1,東京都世田谷区三軒茶屋2-24-17,0.0
1279,山口内科小児科医院,03-3424-3651,-,なし,1,東京都世田谷区三軒茶屋2-6-5,0.0
1280,医療法人社団シンセリティ いなみ内科クリニック,03-3413-1730,-,なし,1,東京都世田谷区三軒茶屋1-13-7三茶JOYビル2階,0.0
1281,恩田メディカルプラザ,03-5726-9327,-,なし,1,東京都世田谷区三軒茶屋2-11-20-5F,0.0
1282,医療法人正心会三軒茶屋内科クリニック,03-3421-4522,-,なし,1,東京都世田谷区三軒茶屋2-20-18-1F,0.0
1283,三軒茶屋駅前おなかクリニック,03-3421-7149,-,なし,1,東京都世田谷区三軒茶屋1-37-2 三茶ビル4階,0.0
1284,はたいしメディカルクリニック,03-5787-5525,-,なし,1,東京都世田谷区三軒茶屋1-35-21 LILAS三軒茶屋２F,0.0
1285,鈴木内科循環器科,03-3412-0072,-,"発熱時に対しては患者さん御本人は、もちろんこと御家族も相談可能です。
夜間にも対応します。",0,東京都世田谷区三軒茶屋1-39-5-202,0.0
1286,医療法人社団高明会 岩崎内科クリニック,03-3419-1085,-,なし,1,東京都世田谷区三軒茶屋２-５６-７,2
1287,ちえ内科クリニック,03-6805-2081,http://www.chienaika.jp,予約サイトからアプローチしてください。,0,東京都世田谷区三軒茶屋１-３２-１４園田ビル２階,0.0
1288,渡辺耳鼻咽喉科医院,03-3425-3900,-,なし,0,東京都世田谷区桜新町2-18-16,0.0
1289,クリニックプラス下北沢,web予約,https://clinicplus.health/reserve,なし,1,東京都世田谷区北沢２-２４-５SHIMOKITA　FRONT　２F,1.0
1290,直宮医院,03-3468-2867,-,発熱外来を受診される場合は必ずお電話ください。　TEL　03-3468-2867,1,東京都世田谷区北沢3-11-14,0.0
1291,佐伯医院,03-3466-8848,-,なし,1,東京都世田谷区北沢4-1-12,0.0
1292,加藤医院,03-3412-1401,-,なし,1,東京都世田谷区北沢2-22-11,0.0
1293,ゆうハートクリニック,03-5432-9310,-,なし,1,東京都世田谷区北沢2-1-6 アーバニティ下北沢２F,0.0
1294,おおた内科クリニック,03-5453-0010,-,なし,1,東京都世田谷区北沢３-２-３東北沢医療ビル２F,0.0
1295,医療法人社団仁英会 島津メディカルクリニック,03-5430-5556,-,なし,1,東京都世田谷区北沢2-22-7 フォルム下北沢１階,0.0
1296,医療法人社団青泉会下北沢病院,03-3460-0300,-,"電話相談受付時間：月～土　9：00～11：30、13：30～16：30
予約センター：03-3460-0021
※当院かかりつけの患者様のみ診療可能です。",0,東京都世田谷区北沢2-8-16,0.0
1297,医療法人社団慈正会 副島クリニック,03-3421-1793,-,なし,1,東京都世田谷区代沢5-3-8-1F,0.0
1298,ひらやまクリニック耳鼻咽喉科,03-5779-1835,-,なし,1,東京都世田谷区代沢３-１２-２３,0.0
1299,かどた内科クリニック,03-6413-8333,-,発熱、咳や息苦しさ、風邪症状等がある方は事前問い合わせをしてからお越しください。,1,東京都世田谷区代沢5-18-1-2階,0.0
1300,代沢内科クリニック,03-3413-1159,-,なし,1,東京都世田谷区代沢4-5-19,0.0
1301,医療法人社団代沢さくら醫院,0334122911,-,なし,1,東京都世田谷区代沢4-45-19,0.0
1302,堀医院,03-3421-2117,-,なし,0,東京都世田谷区代沢３-１６-８,0.0
1303,原医院,03-3421-0688,-,なし,0,東京都世田谷区代沢3-12-17,0.0
1304,淡島こどもクリニック,03-3422-9751,-,なし,0,東京都世田谷区代沢5-18-1 代沢カラバッシュ２F,0.0
1305,梶原内科クリニック,03-3424-8777,-,なし,1,東京都世田谷区代田3ー1ー3ー102,0.0
1306,下北沢西口クリニック,03-3485-5580,-,かかりつけの予約患者のみ対応,0,東京都世田谷区代田６丁目１-２１,0.0
1307,医療法人社団 中島医院,03-3321-7788,-,なし,1,東京都世田谷区大原2-16-7,0.0
1308,小原医院,03-3460-2036,-,なし,1,東京都世田谷区大原１-４９-１４,0.0
1309,医療法人社団篠田会  大原クリニック,03-3324-3077,-,なし,1,東京都世田谷区大原2-23-19,0.0
1310,小久保小児科医院,81333250458,-,なし,0,東京都世田谷区大原2-28-2,0.0
1311,医療法人社団 杏静会 寺田医院,03-3322-2685,-,なし,1,東京都世田谷区羽根木2-17-11,0.0
1312,かわまたこどもクリニック,03-3321-3077,-,なし,1,東京都世田谷区羽根木2-40-23-1F,0.0
1313,明大前クリニック,03-5376-2281,-,なし,1,東京都世田谷区松原2-42-14美鈴Sビル101,0.0
1314,松原ファミリークリニック,03-5355-4976,-,なし,1,東京都世田谷区松原5-42-2,0.0
1315,医療法人社団 星医院,03-3325-3080,-,なし,1,東京都世田谷区松原5-5-1,0.0
1316,世田谷区医師会初期救急診療所,03-5301-0899,-,"平日は小児科のみ対応可能です。内科及び他科の患者さんは受診できませんのでご注意ください。
受診をご希望の際は必ずお電話をお願い致します。",1,東京都世田谷区松原6-37-10,1.0
1317,医療法人社団和順会 吉川小児科,03-5329-4153,-,なし,1,東京都世田谷区松原3-28-8 吉川医療モール2階,0.0
1318,大坪医院,03-3328-2285,-,発熱外来の時間帯であっても一般患者さんの診療がある場合は受け入れできないことがあります。,0,東京都世田谷区松原5-58-11,0.0
1319,世田谷区医師会付属診療所（ＰＣＲ検査センター）,なし,-,なし,0,東京都世田谷区松原６-３７-１０,1.0
1320,井上医院,03-3323-0764,-,なし,0,東京都世田谷区松原6-1-10,0.0
1321,医療法人社団プラタナス 松原アーバンクリニック,03-5355-3388,-,なし,0,東京都世田谷区松原5-34-6 アリア松原1階,0.0
1322,いまじま耳鼻咽喉科,03-5329-5630,-,なし,0,東京都世田谷区松原２-４１-１４,0.0
1323,医療法人社団宝池会 吉川内科医院,03-3323-0661,-,外来患者様のコロナ検査は行っておりません。熱のある方の受診は必ず電話で予約してから来院してください,0,東京都世田谷区松原3-28-8,0.0
1324,うすだ内科クリニック,03-3323-7707,-,なし,0,東京都世田谷区松原2-29-1 ブランテラス松原201,0.0
1325,明大前つじ内科クリニック,03-5300-3377,-,なし,1,東京都世田谷区松原2-41-15エテルノ明大前１F,0.0
1326,医療法人社団武樹会　下高井戸内科医院,03-3324-4696,-,発熱に関する受診をご希望の方は、平日12時30分までにお電話でご予約ください。,1,東京都世田谷区赤堤4-41-4,0.0
1327,医療法人社団幸翔会 鳥居医院,03-5300-7722,-,なし,1,東京都世田谷区赤堤3-2-16,0.0
1328,恵和クリニック,03-5301-2541,-,なし,1,東京都世田谷区赤堤1-37-7,0.0
1329,しもたかいどホームドクタークリニック,03-6379-3677,-,なし,1,東京都世田谷区赤堤5-30-15,0.0
1330,やまおか こどもクリニック,03-5355-5072,-,なし,0,東京都世田谷区赤堤 4-20-1 古谷ビル １F,2
1331,医療法人社団芳史会松原整形外科内科,03-5376-6200,-,予めお電話にてご予約下さい。,0,東京都世田谷区赤堤4-22-7,0.0
1332,和みファミリークリニック,03-4291-9671,-,なし,0,東京都世田谷区赤堤2-44-10,0.0
1333,倉田医院,03-3302-8560,-,なし,1,東京都世田谷区桜上水2-25-12,0.0
1334,大森クリニック,03-3302-6121,-,なし,1,東京都世田谷区桜上水1-9-2,0.0
1335,医療法人社団英親会斎藤クリニック,03-3306-1133,-,なし,1,東京都世田谷区桜上水5-20-11,0.0
1336,林診療所,03-5316-5520,-,経口治療薬については、手続き上は処方が可能な状態ですが、本薬が十分な臨床的治療実績が蓄積されるまでは、基本的には当院では処方しない方針です。,0,東京都世田谷区桜上水4-18-19森本ビル2階,0.0
1337,医療法人社団慈久会山田外科クリニック,03-3420-2704,-,なし,1,東京都世田谷区宮坂3-46-2,0.0
1338,矢野こどもクリニック,03-5426-2877,-,なし,1,東京都世田谷区宮坂3-13-6 経堂すずらん会館１階,0.0
1339,竹川内科医院,03-3706-2341,-,なし,0,東京都世田谷区宮坂1ｰ41ｰ20,2
1340,医療法人社団梢愛会やまうちクリニック,web予約,https://ver2.yoyakuru.net/rs/yamauchi-cl/web/,8/19（金）～27（土）は当院夏季休暇で休診です。,1,東京都世田谷区経堂１-２２-１６サウスコート１階,1.0
1341,医療法人社団Glanz ちとふなキッズクリニック,03-5426-5299,-,なし,1,東京都世田谷区経堂４-３０-４１,0.0
1342,吉澤内科クリニック,03-3427-3777,-,なし,1,東京都世田谷区経堂２-１５-１３,0.0
1343,医療法人社団慈京会 五十子クリニック,03-3426-0220,www.irakoclinic.com,風邪の受付は電話受付のみです。受付時間は、月~木・土の午前中は8：45~9：30月・水の午後は17：45~18：30火・木の午後は13：45~14：30です。,1,東京都世田谷区経堂5-3-29 1階,0.0
1344,くみこキッズクリニック,03-5799-4560,-,"0歳～１８歳までの診療に対応いたします。
事前にインターネットでご予約を必ずお願いします。",1,東京都世田谷区経堂２丁目１４番１０号K・S　KYODO　BUILDING２階,0.0
1345,経堂駅前内科・糖尿病クリニック,03-6413-9905,-,なし,1,東京都世田谷区経堂２-１４-１０ ２F,0.0
1346,農大通り診療所,03-3439-6051,-,かかりつけの患者のみ、事前に電話にて予約の上、対応いたします,0,東京都世田谷区経堂1-5-6　パルファム経堂１階Ａ,0.0
1347,田宮小児科アレルギー科医院,03-3427-7974,-,なし,0,東京都世田谷区経堂５-２１-３,0.0
1348,医療法人社団柴沼会 五十畑クリニック,03-3429-0238,-,なし,0,東京都世田谷区経堂1-11-4 五十畑ビル1F,2
1349,世田谷リウマチ膠原病クリニック,03-6413-4666,-,なし,0,東京都世田谷区経堂2-4-6-102,0.0
1350,経堂耳鼻咽喉科,03ー3425ー3387,-,なし,0,東京都世田谷区経堂２-１-３３,0.0
1351,西クリニック,03-6425-0024,-,なし,1,東京都世田谷区経堂2-1-33経堂コルティ3階,0.0
1352,医療法人社団 英継会 東京血液疾患診療所,03-3425-2808,-,なし,0,東京都世田谷区経堂５-３８-９,1.0
1353,世田谷通り桜内科クリニック,03-3420-1159,-,なし,1,東京都世田谷区桜3-2-6アブニール桜,0.0
1354,ほしの内科・アレルギークリニック,03-5426-6567,-,詳細は、公式HPでご確認ください。,1,東京都世田谷区桜3-2-17DS桜ビル2階,0.0
1355,さくら小児科・内科クリニック,03-6413-2211,-,なし,1,東京都世田谷区桜1-67-8 A・Kビル1F,0.0
1356,まつがおか耳鼻咽喉科医院,0334208749,-,なし,0,東京都世田谷区桜3-2-17　ＤＳ桜ビル　４階ＤＳ桜ビル,0.0
1357,六然会 臼井内科,03-5426-8811,-,なし,1,東京都世田谷区桜 1-65-8 エンブレム経堂1F,2
1358,医療法人社団カナード　かるがもクリニック,web予約,https://karugamo.mdja.jp/,なし,1,東京都世田谷区桜丘２-２５-４,0.0
1359,医療法人社団慈桜会 渡辺クリニック,03-5426-8624,-,なし,1,東京都世田谷区桜丘２-５-２３-１階,0.0
1360,医療法人社団土筆会桜丘クリニック,03-5426-2292,-,なし,1,東京都世田谷区桜丘５丁目１７-４直井ビル1F,0.0
1361,医療法人社団 こしだ内科クリニック,03-3425-1771,-,なし,1,東京都世田谷区桜丘2-27-11レフィ-ノＫＭビル1Ｆ,0.0
1362,医療法人社団クレッセント さくらが丘小児科クリニック,03-3439-3077,-,なし,0,東京都世田谷区桜丘3-10-22,0.0
1363,ちとせ船橋駅前内科,03-5477-1024,-,なし,0,東京都世田谷区桜丘2丁目28-16エンヤビル2階,0.0
1364,医療法人社団井上外科記念会 世田谷井上病院,03-3425-1817,-,なし,0,東京都世田谷区桜丘4-25-8,0.0
1365,社会福祉法人 東京有隣会　有隣病院,03-3482-3611,-,なし,1,東京都世田谷区船橋 2丁目15番38号,0.0
1366,中江クリニック,03-5450-7476,-,受診前に電話連絡をお願いいたします　受診時間を予約いたします　電話診療も予約制です,1,東京都世田谷区船橋1-31-17,0.0
1367,医療法人社団広徳会小山クリニック,03-3290-1133,-,なし,1,東京都世田谷区船橋5-9-6,0.0
1368,せきぐちクリニック,03-3429-4181,-,なし,1,東京都世田谷区船橋1-16-1,0.0
1369,ながよしクリニック,03-6304-6616,-,なし,1,東京都世田谷区船橋5-4-3,0.0
1370,おむすび小児科クリニック,03-5787-7075,-,なし,1,東京都世田谷区船橋4-17-1-1,0.0
1371,医療法人社団檜会 大槻クリニック,03-3484-0341,-,なし,0,東京都世田谷区船橋7-1-3,2
1372,柴本内科,03-3303-8401,-,なし,1,東京都世田谷区八幡山3-32-25,0.0
1373,はたのクリニック,03-3302-8443 ,-,なし,1,東京都世田谷区八幡山1-11-4,0.0
1374,医療法人社団　天晴会　八幡山ハートクリニック,03-5316-9077,-,発熱外来は完全予約制です。必ず事前にお電話をお願い致します。,0,東京都世田谷区八幡山2-4-5,0.0
1375,"医療法人社団敬正会　
あんクリニック世田谷",03-6379-8012,-,なし,0,東京都世田谷区八幡山3-34-15藤和シティコープ八幡山1階,1.0
1376,渡辺内科クリニック,03-3302-2030,-,受診前に電話での問い合わせをお願いします。,1,東京都世田谷区上北沢３-３２-９,0.0
1377,医療法人社団 緑秀会 黒坂内科,03-3329-1517,-,なし,1,東京都世田谷区上北沢1-13-1 アサカシオン上北沢1階,0.0
1378,医療法人社団健優会　三宅小児科,03-3302-2771,-,なし,0,東京都世田谷区上北沢4-21-13,0.0
1379,医療法人社団 陽真会 たかさごクリニック,03-3306-7711,-,遠隔診療は電話診療を実施（かかりつけの患者様のみ）,0,東京都世田谷区上北沢5-12-19クインスコート上北沢1F,0.0
1380,上北沢クリニック,03-3306-2331,-,なし,0,東京都世田谷区上北沢4-11-8,2
1381,社会福祉法人 康和会 久我山病院,03-3309-1111,-,なし,1,東京都世田谷区北烏山2丁目14番20号,0.0
1382,たかはし小児科クリニック,03-3300-2401,-,空間的に発熱患者様を分離するため、必ず事前に診療時間を電話予約（03-3300-2401）して下さい。診療可能な人数には限りがあります。,1,東京都世田谷区北烏山１-２９-３,0.0
